{"$defs":{"case":{"additionalProperties":false,"properties":{"id":{"$ref":"#/$defs/token"},"members":{"items":{"$ref":"#/$defs/spec"},"minItems":1,"type":"array"}},"required":["id","members"],"type":"object"},"error_class":{"enum":["ManifestError","RevisionUnusable","CampaignUnusable",null]},"normalized_code":{"pattern":"^[a-z][a-z0-9._-]{0,127}$","type":"string"},"spec":{"additionalProperties":false,"properties":{"case_id":{"$ref":"#/$defs/token"},"error_class":{"$ref":"#/$defs/error_class"},"expected_code":{"$ref":"#/$defs/normalized_code"},"expected_outcome":{"enum":["pass","refused","unusable"]},"nodeid":{"minLength":1,"type":"string"},"selector":{"$ref":"#/$defs/token"}},"required":["case_id","error_class","expected_code","expected_outcome","nodeid","selector"],"type":"object"},"token":{"pattern":"^[a-z][a-z0-9-]{0,127}$","type":"string"}},"$id":"urn:quarry:schema:manifest-evidence-cases:v1","$schema":"https://json-schema.org/draft/2020-12/schema","additionalProperties":false,"properties":{"corruption_cases":{"items":false,"maxItems":3,"minItems":3,"prefixItems":[{"allOf":[{"$ref":"#/$defs/case"},{"properties":{"id":{"const":"run-manifest-corruption"},"members":{"maxItems":12,"minItems":12}},"required":["id","members"]}]},{"allOf":[{"$ref":"#/$defs/case"},{"properties":{"id":{"const":"revision-overlay-pointer-corruption"},"members":{"maxItems":4,"minItems":4}},"required":["id","members"]}]},{"allOf":[{"$ref":"#/$defs/case"},{"properties":{"id":{"const":"campaign-terminal-history-corruption"},"members":{"maxItems":6,"minItems":6}},"required":["id","members"]}]}],"type":"array"},"invariants":{"items":{"$ref":"#/$defs/spec"},"maxItems":18,"minItems":18,"type":"array"},"release":{"const":"0.3.10"},"schema_version":{"const":"quarry.manifest-evidence-cases.v1"}},"required":["corruption_cases","invariants","release","schema_version"],"type":"object"}
