{"corruption_cases":[{"id":"run-manifest-corruption","members":[{"case_id":"extra-keys","error_class":"ManifestError","expected_code":"manifest.extra_keys","expected_outcome":"refused","nodeid":"tests/test_run_manifest_contract.py::test_semantic_manifest_corruption_refuses_every_consumer[extra-keys]","selector":"extra-keys"},{"case_id":"schema-version","error_class":"ManifestError","expected_code":"manifest.schema_version","expected_outcome":"refused","nodeid":"tests/test_run_manifest_contract.py::test_semantic_manifest_corruption_refuses_every_consumer[schema-version]","selector":"schema-version"},{"case_id":"entity-counts","error_class":"ManifestError","expected_code":"manifest.entity_counts","expected_outcome":"refused","nodeid":"tests/test_run_manifest_contract.py::test_semantic_manifest_corruption_refuses_every_consumer[entity-counts]","selector":"entity-counts"},{"case_id":"tools-failed","error_class":"ManifestError","expected_code":"manifest.tools_failed","expected_outcome":"refused","nodeid":"tests/test_run_manifest_contract.py::test_semantic_manifest_corruption_refuses_every_consumer[tools-failed]","selector":"tools-failed"},{"case_id":"verdict","error_class":"ManifestError","expected_code":"manifest.verdict","expected_outcome":"refused","nodeid":"tests/test_run_manifest_contract.py::test_semantic_manifest_corruption_refuses_every_consumer[verdict]","selector":"verdict"},{"case_id":"generation","error_class":"ManifestError","expected_code":"manifest.generation","expected_outcome":"refused","nodeid":"tests/test_run_manifest_contract.py::test_semantic_manifest_corruption_refuses_every_consumer[generation]","selector":"generation"},{"case_id":"base-files","error_class":"ManifestError","expected_code":"manifest.base_files","expected_outcome":"refused","nodeid":"tests/test_run_manifest_contract.py::test_semantic_manifest_corruption_refuses_every_consumer[base-files]","selector":"base-files"},{"case_id":"lifecycle-extra-key","error_class":"ManifestError","expected_code":"lifecycle.extra_key","expected_outcome":"refused","nodeid":"tests/test_run_manifest_contract.py::test_lifecycle_sidecar_has_one_strict_semantic_contract[extra-key]","selector":"extra-key"},{"case_id":"lifecycle-bad-updated","error_class":"ManifestError","expected_code":"lifecycle.bad_updated","expected_outcome":"refused","nodeid":"tests/test_run_manifest_contract.py::test_lifecycle_sidecar_has_one_strict_semantic_contract[bad-updated]","selector":"bad-updated"},{"case_id":"lifecycle-bad-detail","error_class":"ManifestError","expected_code":"lifecycle.bad_detail","expected_outcome":"refused","nodeid":"tests/test_run_manifest_contract.py::test_lifecycle_sidecar_has_one_strict_semantic_contract[bad-detail]","selector":"bad-detail"},{"case_id":"lifecycle-bad-stage","error_class":"ManifestError","expected_code":"lifecycle.bad_stage","expected_outcome":"refused","nodeid":"tests/test_run_manifest_contract.py::test_lifecycle_sidecar_has_one_strict_semantic_contract[bad-stage]","selector":"bad-stage"},{"case_id":"lifecycle-invalid-state","error_class":"ManifestError","expected_code":"lifecycle.invalid_state","expected_outcome":"refused","nodeid":"tests/test_run_manifest_contract.py::test_lifecycle_sidecar_has_one_strict_semantic_contract[invalid-state]","selector":"invalid-state"}]},{"id":"revision-overlay-pointer-corruption","members":[{"case_id":"pointer","error_class":"RevisionUnusable","expected_code":"revision.pointer","expected_outcome":"unusable","nodeid":"tests/test_v310_revision_transaction.py::test_evidence_corruption_matrix_fails_closed[pointer]","selector":"pointer"},{"case_id":"entity","error_class":"RevisionUnusable","expected_code":"revision.entity","expected_outcome":"unusable","nodeid":"tests/test_v310_revision_transaction.py::test_evidence_corruption_matrix_fails_closed[entity]","selector":"entity"},{"case_id":"segment","error_class":"RevisionUnusable","expected_code":"revision.segment","expected_outcome":"unusable","nodeid":"tests/test_v310_revision_transaction.py::test_evidence_corruption_matrix_fails_closed[segment]","selector":"segment"},{"case_id":"raw","error_class":"RevisionUnusable","expected_code":"revision.raw","expected_outcome":"unusable","nodeid":"tests/test_v310_revision_transaction.py::test_evidence_corruption_matrix_fails_closed[raw]","selector":"raw"}]},{"id":"campaign-terminal-history-corruption","members":[{"case_id":"terminal-success","error_class":"CampaignUnusable","expected_code":"campaign.terminal_success","expected_outcome":"unusable","nodeid":"tests/test_v310_campaign_truth.py::test_contradictory_terminal_documents_are_unusable[success]","selector":"success"},{"case_id":"terminal-clean","error_class":"CampaignUnusable","expected_code":"campaign.terminal_clean","expected_outcome":"unusable","nodeid":"tests/test_v310_campaign_truth.py::test_contradictory_terminal_documents_are_unusable[clean]","selector":"clean"},{"case_id":"terminal-terminal","error_class":"CampaignUnusable","expected_code":"campaign.terminal_cause","expected_outcome":"unusable","nodeid":"tests/test_v310_campaign_truth.py::test_contradictory_terminal_documents_are_unusable[terminal]","selector":"terminal"},{"case_id":"terminal-non-terminal","error_class":"CampaignUnusable","expected_code":"campaign.terminal_nonterminal","expected_outcome":"unusable","nodeid":"tests/test_v310_campaign_truth.py::test_contradictory_terminal_documents_are_unusable[non-terminal]","selector":"non-terminal"},{"case_id":"terminal-open-gaps","error_class":"CampaignUnusable","expected_code":"campaign.open_gaps","expected_outcome":"unusable","nodeid":"tests/test_v310_campaign_truth.py::test_contradictory_terminal_documents_are_unusable[open-gaps]","selector":"open-gaps"},{"case_id":"forged-resolution","error_class":"CampaignUnusable","expected_code":"campaign.forged_resolution","expected_outcome":"unusable","nodeid":"tests/test_v310_campaign_truth.py::test_a_forged_resolution_without_matching_evidence_is_unusable","selector":"forged-resolution"}]}],"invariants":[{"case_id":"writer-manifest","error_class":null,"expected_code":"writer-manifest","expected_outcome":"pass","nodeid":"tests/test_run_manifest_contract.py::test_writer_emits_one_canonical_reconciled_v1_manifest","selector":"canonical-writer"},{"case_id":"noncanonical-encoding","error_class":null,"expected_code":"noncanonical-encoding","expected_outcome":"pass","nodeid":"tests/test_run_manifest_contract.py::test_noncanonical_and_duplicate_member_encodings_are_not_commitments","selector":"noncanonical-duplicate"},{"case_id":"lifecycle-identity","error_class":null,"expected_code":"lifecycle-identity","expected_outcome":"pass","nodeid":"tests/test_run_manifest_contract.py::test_lifecycle_identity_is_verified_by_authoritative_consumers","selector":"authoritative-lifecycle"},{"case_id":"revision-overlay","error_class":null,"expected_code":"revision-overlay","expected_outcome":"pass","nodeid":"tests/test_v310_revision_transaction.py::test_disjoint_revisions_republish_the_full_effective_overlay","selector":"effective-overlay"},{"case_id":"revision-pointer","error_class":null,"expected_code":"revision-pointer","expected_outcome":"pass","nodeid":"tests/test_v310_revision_transaction.py::test_revision_binds_pointer_entities_segments_raw_and_views","selector":"pointer-entity-segment-raw-view"},{"case_id":"campaign-gap-laundering","error_class":null,"expected_code":"campaign-gap-laundering","expected_outcome":"pass","nodeid":"tests/test_v310_campaign_truth.py::test_a_later_silent_child_cannot_launder_an_earlier_gap","selector":"silent-child-gap"},{"case_id":"campaign-history-reload","error_class":null,"expected_code":"campaign-history-reload","expected_outcome":"pass","nodeid":"tests/test_v310_campaign_truth.py::test_gap_history_and_resolution_survive_reload","selector":"gap-history-reload"},{"case_id":"summary-projection","error_class":null,"expected_code":"summary-projection","expected_outcome":"pass","nodeid":"tests/test_run_manifest_contract.py::test_summary_projections_are_recomputed_from_authenticated_logs","selector":"authenticated-summary"},{"case_id":"malformed-remainder","error_class":null,"expected_code":"malformed-remainder","expected_outcome":"pass","nodeid":"tests/test_run_manifest_contract.py::test_malformed_remainder_is_explicitly_gapped_not_clean","selector":"malformed-remainder"},{"case_id":"event-sink-degradation","error_class":null,"expected_code":"event-sink-degradation","expected_outcome":"pass","nodeid":"tests/test_run_manifest_contract.py::test_event_sink_degradation_cannot_be_bound_to_a_clean_summary","selector":"event-sink-degradation"},{"case_id":"envelope-degradation","error_class":null,"expected_code":"envelope-degradation","expected_outcome":"pass","nodeid":"tests/test_run_manifest_contract.py::test_envelope_degradation_cannot_be_bound_to_a_clean_summary","selector":"envelope-degradation"},{"case_id":"positive-coverage","error_class":null,"expected_code":"positive-coverage","expected_outcome":"pass","nodeid":"tests/test_v310_campaign_truth.py::test_only_matching_positive_coverage_resolves_the_historical_gap","selector":"matching-positive-coverage"},{"case_id":"mismatch-wrong-source","error_class":null,"expected_code":"mismatch-wrong-source","expected_outcome":"pass","nodeid":"tests/test_v310_campaign_truth.py::test_mismatched_or_incomplete_coverage_cannot_resolve_a_gap[wrong-source]","selector":"wrong-source"},{"case_id":"mismatch-wrong-measure","error_class":null,"expected_code":"mismatch-wrong-measure","expected_outcome":"pass","nodeid":"tests/test_v310_campaign_truth.py::test_mismatched_or_incomplete_coverage_cannot_resolve_a_gap[wrong-measure]","selector":"wrong-measure"},{"case_id":"mismatch-incomplete-coverage","error_class":null,"expected_code":"mismatch-incomplete-coverage","expected_outcome":"pass","nodeid":"tests/test_v310_campaign_truth.py::test_mismatched_or_incomplete_coverage_cannot_resolve_a_gap[incomplete-coverage]","selector":"incomplete-coverage"},{"case_id":"unmeasured-remai